{
  "schema_version": "4.0",
  "judgment_id": "judge-95ad24debf1c4d3da2b7126df92ce983",
  "execution_id": "reference-b913da7742a841b1b004a9bc270cc071",
  "case_id": "case001-v2",
  "task_id": "case001-v2.empty",
  "judge_id": "case001-v2.judge-v1",
  "status": "passed",
  "passed": true,
  "checks": [
    {
      "name": "identity",
      "passed": true,
      "reason": "Execution must use this task and judge"
    },
    {
      "name": "input_unchanged",
      "passed": true,
      "reason": "Compare input byte hashes before and after execution"
    },
    {
      "name": "output_file_set",
      "passed": true,
      "reason": "No missing or extra output files"
    },
    {
      "name": "expected_rejection",
      "passed": true,
      "reason": "Expected invalid input must be rejected explicitly"
    },
    {
      "name": "no_infrastructure_error",
      "passed": true,
      "reason": "Infrastructure/missing evidence cannot be a task pass"
    }
  ],
  "reason": "Frozen task criteria checked; this does not prove correctness on untested inputs",
  "execution_checksums_sha256": "1b9ea65c21a6c4779aa165077593daa2952c7803d1ae4951937699c87cd6f556",
  "judge_sha256": "4df233da7f7c1a944f681956a3518b747f10ca7fcb368cc461e8e6bf2c92b5a0",
  "created_at_utc": "2026-09-26T14:17:38.352769+00:00"
}
