{
  "schema_version": "4.0",
  "judgment_id": "judge-3323118a815449ecb9ab4a5a4221a244",
  "execution_id": "reference-fb3278a105de4a938e1f992a2feb4fce",
  "case_id": "case001-v2",
  "task_id": "case001-v2.example",
  "judge_id": "case001-v2.judge-v1",
  "status": "passed",
  "passed": true,
  "checks": [
    {
      "name": "identity",
      "passed": true,
      "reason": "Execution must use this task and judge"
    },
    {
      "name": "input_unchanged",
      "passed": true,
      "reason": "Compare input byte hashes before and after execution"
    },
    {
      "name": "output_file_set",
      "passed": true,
      "reason": "No missing or extra output files"
    },
    {
      "name": "content:deduplicated.csv",
      "passed": true,
      "reason": "Exact UTF-8 content, LF, header, sorting and quoting"
    },
    {
      "name": "content:summary.csv",
      "passed": true,
      "reason": "Exact UTF-8 content, LF, header, sorting and quoting"
    },
    {
      "name": "successful_exit",
      "passed": true,
      "reason": "Success requires normal completion"
    },
    {
      "name": "no_infrastructure_error",
      "passed": true,
      "reason": "Infrastructure/missing evidence cannot be a task pass"
    }
  ],
  "reason": "Frozen task criteria checked; this does not prove correctness on untested inputs",
  "execution_checksums_sha256": "4bda6207b6c428937fd843409939f58b1a2140fc23b812baf9f21bb3656ba67b",
  "judge_sha256": "4df233da7f7c1a944f681956a3518b747f10ca7fcb368cc461e8e6bf2c92b5a0",
  "created_at_utc": "2026-09-26T14:17:38.295282+00:00"
}
