{
  "schema_version": "4.0",
  "judgment_id": "judge-5c90f6267a374c09ac258b9760d25381",
  "execution_id": "reference-8d2b88b7523f47c78613933c2b78799c",
  "case_id": "case001-v2",
  "task_id": "case001-v2.invalid_amount_NA",
  "judge_id": "case001-v2.judge-v1",
  "status": "passed",
  "passed": true,
  "checks": [
    {
      "name": "identity",
      "passed": true,
      "reason": "Execution must use this task and judge"
    },
    {
      "name": "input_unchanged",
      "passed": true,
      "reason": "Compare input byte hashes before and after execution"
    },
    {
      "name": "output_file_set",
      "passed": true,
      "reason": "No missing or extra output files"
    },
    {
      "name": "expected_rejection",
      "passed": true,
      "reason": "Expected invalid input must be rejected explicitly"
    },
    {
      "name": "error_record",
      "passed": true,
      "reason": "Required error location"
    },
    {
      "name": "error_field",
      "passed": true,
      "reason": "Required error location"
    },
    {
      "name": "no_infrastructure_error",
      "passed": true,
      "reason": "Infrastructure/missing evidence cannot be a task pass"
    }
  ],
  "reason": "Frozen task criteria checked; this does not prove correctness on untested inputs",
  "execution_checksums_sha256": "eeef6c51fed303619eaab89cc90093c532246915c06aaa59c039bf4cf0234c97",
  "judge_sha256": "4df233da7f7c1a944f681956a3518b747f10ca7fcb368cc461e8e6bf2c92b5a0",
  "created_at_utc": "2026-09-26T14:17:38.388145+00:00"
}
